{
  "id": "zoom_out",
  "name": {
    "en": "Zoom Out",
    "ja": "ズームアウト",
    "id": "Perkecil"
  },
  "duration_ms": 800,
  "relative": true,
  "hold": true,
  "tags": [
    "basic"
  ],
  "keys": [
    {
      "t": 0
    },
    {
      "t": 1,
      "dzoom": -0.25,
      "ease": "ease_out_cubic"
    }
  ]
}
